{
  "$schema": "https://json-schema.org/draft/2020-12/schema",
  "$id": "https://schemas.codex-video-edit.invalid/pass_checkpoint.schema.json",
  "title": "Verified editorial pass checkpoint",
  "type": "object",
  "additionalProperties": false,
  "required": [
    "schema_version",
    "checkpoint_id",
    "request_id",
    "request_sha256",
    "checkpoint_sha256",
    "project_id",
    "draft_id",
    "base_revision_id",
    "draft_sequence",
    "timeline_sha256",
    "head_transaction_sha256",
    "pass_group",
    "verified_transaction_ids",
    "summary",
    "checks",
    "created_at",
    "status"
  ],
  "properties": {
    "schema_version": { "const": "1.0" },
    "checkpoint_id": { "$ref": "#/$defs/id" },
    "request_id": { "$ref": "#/$defs/id" },
    "request_sha256": { "$ref": "#/$defs/hash" },
    "checkpoint_sha256": { "$ref": "#/$defs/hash" },
    "project_id": { "$ref": "#/$defs/id" },
    "draft_id": { "$ref": "#/$defs/id" },
    "base_revision_id": { "$ref": "#/$defs/id" },
    "draft_sequence": { "type": "integer", "minimum": 1 },
    "timeline_sha256": { "$ref": "#/$defs/hash" },
    "head_transaction_sha256": { "$ref": "#/$defs/hash" },
    "pass_group": { "$ref": "#/$defs/pass_group" },
    "verified_transaction_ids": {
      "type": "array",
      "minItems": 1,
      "maxItems": 64,
      "uniqueItems": true,
      "items": { "$ref": "#/$defs/id" }
    },
    "summary": { "type": "string", "minLength": 1, "maxLength": 1000 },
    "checks": {
      "type": "array",
      "minItems": 1,
      "maxItems": 64,
      "uniqueItems": true,
      "x-uniqueBy": "check_id",
      "description": "Checks are unique as complete values and the strict runtime validator additionally requires unique check_id values.",
      "items": { "$ref": "#/$defs/check" }
    },
    "created_at": { "$ref": "#/$defs/timestamp" },
    "status": { "const": "verified" }
  },
  "$defs": {
    "id": {
      "type": "string",
      "pattern": "^[A-Za-z0-9][A-Za-z0-9._-]{1,127}$"
    },
    "hash": { "type": "string", "pattern": "^[a-f0-9]{64}$" },
    "timestamp": {
      "type": "string",
      "pattern": "^\\d{4}-\\d{2}-\\d{2}T\\d{2}:\\d{2}:\\d{2}(?:\\.\\d+)?Z$"
    },
    "pass_group": {
      "type": "object",
      "additionalProperties": false,
      "required": ["pass_group_id", "kind"],
      "properties": {
        "pass_group_id": { "$ref": "#/$defs/id" },
        "kind": {
          "enum": [
            "manual",
            "spoken_cut",
            "layout",
            "zoom",
            "captions",
            "speed",
            "audio",
            "broll",
            "cursor"
          ]
        }
      }
    },
    "check": {
      "type": "object",
      "additionalProperties": false,
      "required": ["check_id", "status", "method", "evidence_ids"],
      "properties": {
        "check_id": { "$ref": "#/$defs/id" },
        "status": { "const": "pass" },
        "method": { "type": "string", "minLength": 1, "maxLength": 1000 },
        "evidence_ids": {
          "type": "array",
          "maxItems": 64,
          "uniqueItems": true,
          "items": { "$ref": "#/$defs/id" }
        }
      }
    }
  }
}
