{
  "schema_version": "1.0",
  "checkpoint_id": "checkpoint-spoken-001",
  "request_id": "request-checkpoint-001",
  "request_sha256": "6666666666666666666666666666666666666666666666666666666666666666",
  "checkpoint_sha256": "7777777777777777777777777777777777777777777777777777777777777777",
  "project_id": "project-demo-001",
  "draft_id": "draft-demo-001",
  "base_revision_id": "rev-001",
  "draft_sequence": 1,
  "timeline_sha256": "1111111111111111111111111111111111111111111111111111111111111111",
  "head_transaction_sha256": "2222222222222222222222222222222222222222222222222222222222222222",
  "pass_group": { "pass_group_id": "pass-spoken-001", "kind": "spoken_cut" },
  "verified_transaction_ids": ["transaction-trim-001"],
  "summary": "Verified the spoken-cut join against the persisted draft.",
  "checks": [
    {
      "check_id": "check-join-001",
      "status": "pass",
      "method": "Decoded and reviewed the bounded join.",
      "evidence_ids": ["evidence-join-001"]
    }
  ],
  "created_at": "2026-09-12T12:02:00.000Z",
  "status": "verified"
}
